file_name,uni,wylie,url,dept,grade,char_len,audio_len,path,inf
STT_NS_M0243_0067_445560_to_448802,ལོ་མཐའ་མ་དེ་ཆགས་ཀྱི་ཡོད་རེད་རཱ། ཨེ་ནས་ང་ཚོ་ཉིན་གུང་རྒྱབ་ལ་གཉིད་ཁུག ,lo mtha' ma de chags kyi yod red rA/_e nas nga tsho nyin gung rgyab la gnyid khug_,https://d38pmlk0v88drf.cloudfront.net/wav16k/STT_NS_M0243_0067_445560_to_448802.wav,STT_NS,3,67,3.242,wav16k/STT_NS_M0243_0067_445560_to_448802.wav,ལོ་མཐའ་མ་དེ་ཆགས་ཀི་ཡོད་རེད་རཱ། ཨེ་ནས་ང་ཚོ་ཉིན་གུང་རྒྱབ་ལ་གཉིད་ཁུག
STT_NS_M0243_0061_408364_to_411777,ཨེ་འདྲའི་འདྲ་བོ་ད་ང་ལ་དྲིས་ནས་ད་སྐད་ཆ་བཤད་ཡ་དཔེ་མང་པོ་ཡོད་རཱ། ཡིན་ནས།  ,e 'dra'i 'dra bo da nga la dris nas da skad cha bshad ya dpe mang po yod rA/_yin nas/__,https://d38pmlk0v88drf.cloudfront.net/wav16k/STT_NS_M0243_0061_408364_to_411777.wav,STT_NS,3,71,3.413,wav16k/STT_NS_M0243_0061_408364_to_411777.wav,ཨེ་འདྲའི་འདྲ་བོ་ད་ང་ལ་དྲི་ནས་ཀི་ད་སྐད་ཆ་བཤད་ཡ་དཔེ་མང་པོ་ཡོད་རཱ། ཡིན་ནས།
STT_NS_M0320_0133_834044_to_842659,མི་གཞན་པ་གཅིག་ཆེད་དུ་ལས་ཀ་བྱེད་ཀ་འགྲོ། མི་གཞན་པ་གཅིག་ཀ་ཅི་ཞིང་ཁ་ལ་ལས་ཀ་བྱས། མི་གཞན་པ་གཅིག་ཀ་ཅི་བཟོ་གྲྭ་ལ་ལས་ཀ་བྱེད། ཨེ་འདྲའི་འདྲ་བོ་བྱེད་བསྡད་དུས་ཙམ་པ་ལ་ད་ཁོ་ཚོ་གཉིས་ཡོད་བ།  ,mi gzhan pa gcig ched du las ka byed ka 'gro/_mi gzhan pa gcig ka ci zhing kha la las ka byas/_mi gzhan pa gcig ka ci bzo grwa la las ka byed/_e 'dra'i 'dra bo byed bsdad dus tsam pa la da kho tsho gnyis yod ba/__,https://d38pmlk0v88drf.cloudfront.net/wav16k/STT_NS_M0320_0133_834044_to_842659.wav,STT_NS,3,174,8.615,wav16k/STT_NS_M0320_0133_834044_to_842659.wav,མི་གཞན་པ་གཅིག་ཆེད་དུ་ལས་ཀ་བྱེད་ག་འགྲོ། མི་གཞན་པ་གཅིག་ཀ་ཅི་ཞིང་ཁ་ལ་ལས་ཀ་བྱས། མི་གཞན་པ་གཅིག་ཀ་ཅི་བཟོ་གྲྭ་ལ་ལས་ཀ་བྱས་ཨེ་འདྲའི་འདྲ་བོ་བྱེད་བསྡད་དུས་ཙམ་པ་ལ་ད་ཁོ་ཚོ་གཉིས་ཡོད་བ།
STT_NS0130_0208_1587709_to_1594392,ཐ་ང་ག་དུས་ཤི་ཀི་རེད། དེ་འདྲ་ཤི་ཡ་གི་སྒང་ལ་སེམས་ཁྲལ་ཅིག་འདུག་བ། དེ་དེ་ཡང་རྨོ་རྨོལགས་ཁྱེད་རང་འདྲ་བོ་ཡིན་ན་སླེབས་ཀི་འདུག་གས་ཡང་། ག་འདྲ་འདྲ་བོ་སླེབས་ཀི་འདུག ང་འཁོར་དང་འཁོར་བུ།  ,tha nga ga dus shi ki red/_de 'dra shi ya gi sgang la sems khral cig 'dug ba/_de de yang rmo rmolags khyed rang 'dra bo yin na slebs ki 'dug gas yang /_ga 'dra 'dra bo slebs ki 'dug_nga 'khor dang 'khor bu/__,https://d38pmlk0v88drf.cloudfront.net/wav16k/STT_NS0130_0208_1587709_to_1594392.wav,STT_NS,3,173,6.683,wav16k/STT_NS0130_0208_1587709_to_1594392.wav,ད་ང་ག་དུས་ཤི་ཀི་རེད། དེ་འདྲའི་བཤད་ཡ་གི་སྒང་ལ་སེམས་ཁྲལ་ཅིག་འདུག་བ།  དེ་དེ་ཡང་རརྨོ་མོ་ལགས་ཁྱེད་རང་འདྲ་བོ་ཡིན་ན་སླེབས་ཀི་འདུག་བེ་ཡང་། ག་འདྲའ་ི་འདྲ་བོ་སེ་་བོ།
STT_NS_M0320_0077_484505_to_492226,ཁོ་ལག་པ་ཤུགས་ཆེ་དྲགས་རཱ། ཨེ་ནས་ཙི་ཙི་དེ་ད་ཤི་གི་རེད་ཡོད་བ། ཨེ་ནས་ད་ཁོ་ཡི་ཙི་ཙི་འདི་ད་ཁོ་རང་ཀ་ཅི་སྦ་ཁུག་ནང་བདགས་ནས་བཞག་བཞག་གི་རེད།  ,kho lag pa shugs che drags rA/_e nas tsi tsi de da shi gi red yod ba/_e nas da kho yi tsi tsi 'di da kho rang ka ci sba khug nang bdags nas bzhag bzhag gi red/__,https://d38pmlk0v88drf.cloudfront.net/wav16k/STT_NS_M0320_0077_484505_to_492226.wav,STT_NS,3,131,7.721,wav16k/STT_NS_M0320_0077_484505_to_492226.wav,ཁོ་ལག་པ་ཤུགས་ཆེ་དྲགས་རཱ། ཨེ་ནས་ཙི་ཙི་དེ་ད་ཤི་ཡི་རེད་ཡོད་བ། ཨེ་ནས་ད་ཁོ་ཡིས་ཙི་ཙི་འདེ་ད་ཁོ་རང་ཀ་ཅི་སྦ་ཁུག་ནང་བདངས་ནས་བཞག་བཞག་གི་རེད།
STT_NS_M0243_0070_461980_to_463985,ཨོ་དེ་དུས་སྐབས་སུ་ཨ་ནས། ཁ་ལག ,o de dus skabs su a nas/_kha lag_,https://d38pmlk0v88drf.cloudfront.net/wav16k/STT_NS_M0243_0070_461980_to_463985.wav,STT_NS,3,29,2.005,wav16k/STT_NS_M0243_0070_461980_to_463985.wav,ཨོ་དེ་དུས་སྐབས་སུ་ཨེ་ནས་ཁ་ལག
STT_NS_M0243_0112_725921_to_728950,དཀའ་ལས་བརྒྱབ་མ་བརྒྱབ་སོ་སོའི་ལག་པར་རག་ལས་ཀྱི་རེད། ཨེ་འདྲ་གི་བསམ་བློ་མང་པོ་དཔེ་སླེབས་ཀྱི་འདུག་བ།  ,dka' las brgyab ma brgyab so so'i lag par rag las kyi red/_e 'dra gi bsam blo mang po dpe slebs kyi 'dug ba/__,https://d38pmlk0v88drf.cloudfront.net/wav16k/STT_NS_M0243_0112_725921_to_728950.wav,STT_NS,3,97,3.029,wav16k/STT_NS_M0243_0112_725921_to_728950.wav,དཀའ་ལས་བརྒྱབ་མ་བརྒྱབས་སོ་སོའི་ལག་པ་རག་ལས་ཀི་རེད། ཨེ་འདྲའ་གི་བསམ་བློ་མང་པོ་དཔེ་སླེབས་ཀི་འདུག་བ།
STT_NS_M0243_0118_754625_to_760043,ཨེ་ནས་ཨེ་འདྲའི་སྐབས་སུ་དང་པོ་ད་ཡ་ཡུད་དཀའ་ངལ་སྤྲད་ཀི་འདུག དངོས་གནས་ལབ་ཡིན་སོ་སོ་གཅིག་པོ་འགྲོ་སོ་སོ་གཅིག་པོ་ཟ་སོ་སོ་གཟུགས་པོ།  ,e nas e 'dra'i skabs su dang po da ya yud dka' ngal sprad ki 'dug_dngos gnas lab yin so so gcig po 'gro so so gcig po za so so gzugs po/__,https://d38pmlk0v88drf.cloudfront.net/wav16k/STT_NS_M0243_0118_754625_to_760043.wav,STT_NS,3,125,5.418,wav16k/STT_NS_M0243_0118_754625_to_760043.wav,ཨེ་ནས་ཨེ་དུས་སྐབས་སུ་དང་པོ་ད་ཡ་ཡུད་དཀའ་ངལ་སྤྲད་ཀི་འདུག དངོས་གནས་ལབ་ཡིན། སོ་སོ་གཅིག་པུ་འགྲོ། སོ་སོ་གཅིག་པོ་ཟ་སོ་སོ་སོག་པོ།
STT_NS_M0243_0073_482680_to_484963,རྗེས་ལུས་ཐེབས་ནས་སྟེང་ནས་འགྲོ་ཡ་ཅིག་ཡོད་བ། ག་རེ་བྱས་ནས་ལབ་ན།  ,rjes lus thebs nas steng nas 'gro ya cig yod ba/_ga re byas nas lab na/__,https://d38pmlk0v88drf.cloudfront.net/wav16k/STT_NS_M0243_0073_482680_to_484963.wav,STT_NS,3,62,2.283,wav16k/STT_NS_M0243_0073_482680_to_484963.wav,རྗེས་ལུས་ཐེབ་ནས་གཏེང་ནས་འགྲོ་ཡ་ཅིག་ཡོད་བ། ག་རེ་བྱས་ནས་ལབ་ན།
STT_NS_M0243_0074_485432_to_487587,རྗེས་ལ་འགྲོ་ན་ང་ཚོ་ལ་འདུག་བ། ཐཱ་ལི་ཆེན་པོ་རག་གི་ཡོད་རེད།  ,rjes la 'gro na nga tsho la 'dug ba/_thA li chen po rag gi yod red/__,https://d38pmlk0v88drf.cloudfront.net/wav16k/STT_NS_M0243_0074_485432_to_487587.wav,STT_NS,3,58,2.155,wav16k/STT_NS_M0243_0074_485432_to_487587.wav,རྗེས་ལ་འགྲོ་ན་ང་ཚོ་ལ་འདུག་བ ཐ་ལིང་ཆེན་པོ་རག་གི་ཡོད་རེད།
STT_NS_M0243_0088_586254_to_590264,ཏཱ་ལའི་བླ་མ་མཐོ་རིམ་སློབ་གཉེར་ཁང་ས་རྒྱལ་ས་བྷེང་ལོར་ལ་སླེབས་ཡོད་རེད། ཨེ་ནས།  ,tA la'i bla ma mtho rim slob gnyer khang sa rgyal sa b+heng lor la slebs yod red/_e nas/__,https://d38pmlk0v88drf.cloudfront.net/wav16k/STT_NS_M0243_0088_586254_to_590264.wav,STT_NS,3,76,4.01,wav16k/STT_NS_M0243_0088_586254_to_590264.wav,ཏཱ་ལའི་བླ་མ་མཐོ་རིམ་སློབ་གཉེར་ཁང་ས་རྒྱལ་ས་བྷེང་ལོར་ལ་སླེབས་ཡོད་རེད། ཨེ་ནས།
STT_NS_M0243_0093_620008_to_626970,ང་ཐེངས་མ་ག་ཚོད་བར་དུ་མོར་ལབ་བསྡད་དགོས་རེད། མོའི་ནོར་འཁྲུལ་དེ་བཏོན་བསྡད་དགོས་རེད་རེད་བ། ད་ང་ཉོབ་སོང་ལབ་ཡ་ཡོད་བ། ཨེ་ནས་ངས་བཞག་བཞག་ཡིན་པ་ད་མོ་རང་མོ་རང་བསམ་བློ་ཅིག་ཐོངས་འགྲོ་ཡི་རེད་བསམ་ནས་ཡོད་བ།  ,nga thengs ma ga tshod bar du mor lab bsdad dgos red/_mo'i nor 'khrul de bton bsdad dgos red red ba/_da nga nyob song lab ya yod ba/_e nas ngas bzhag bzhag yin pa da mo rang mo rang bsam blo cig thongs 'gro yi red bsam nas yod ba/__,https://d38pmlk0v88drf.cloudfront.net/wav16k/STT_NS_M0243_0093_620008_to_626970.wav,STT_NS,3,192,6.962,wav16k/STT_NS_M0243_0093_620008_to_626970.wav,ང་ཐེངས་མ་ག་ཚོད་བར་དུ་མོ་ལབ་བསྡད་དགོས་རེད། མོ་ནོར་འཁྲུལ་སྟོན་བསྡད་དགོས་རེད་རཱ། ད་ང་ཉོབ་སོང་ལབ་ཡ་ཡོད་བ། ཨེ་ནས་ངས་བཞག་བཞག་ཡིན་པ། ད་མོ་རང་མོ་རང་བསམ་བློ་ཅིག་མཐོང་རུ་འགྲོ་ཡི་རེད་བསམ་ནས་ཡོད་བ།
STT_NS_M0243_0098_651715_to_658523,ཕྱོགས་གཅིག་ནས་ད་དངོས་ནས་ཁོ་རང་རོགས་པ་ལབ་ཡ་དེ་དགོས་ཡ་དཔེ་གལ་ཆེན་པོ་རེད་འདུག་རཱ། མི་ཚེའི་ནང་ལ་ག་རེ་ལས་ཀ་ག་རེ་འདྲ་བོ་ཅིག་བྱེད་བ་ཡིན་ན་ཡང་རོགས་པ་ལབ་ཡ་དེ་དགོས་ཡ་དཔེ་གལ་ཆེན་པོ་རེད་འདུག་རཱ།  ,phyogs gcig nas da dngos nas kho rang rogs pa lab ya de dgos ya dpe gal chen po red 'dug rA/_mi tshe'i nang la ga re las ka ga re 'dra bo cig byed ba yin na yang rogs pa lab ya de dgos ya dpe gal chen po red 'dug rA/__,https://d38pmlk0v88drf.cloudfront.net/wav16k/STT_NS_M0243_0098_651715_to_658523.wav,STT_NS,3,184,6.808,wav16k/STT_NS_M0243_0098_651715_to_658523.wav,ཕྱོགས་གཅིག་ནས་ད་དངོས་གནས་ཁོ་རང་རོགས་པ་ལབ་ཡ་དེ་དགོས་ཡ་དཔེ་གལ་ཆེན་པོ་རེད་འདུག་རཱ། མི་ཚེའི་ནང་ལ་ག་རེ་ལས་ཀ་ག་རེ་འདྲ་བོ་བྱེད་ཡ་ཡིན་ནས་ རོགས་པ་ལབ་ཡ་དེ་དགོས་ཡ་དཔེ་གལ་ཆེན་པོ་རེད་འདུག་རཱ།
STT_NS_M0243_0099_659274_to_664189,རོགས་པ་ལབ་ཡ་དེ་བརྒྱུད་ནས་ཀིས། ང་ཚོ་གི་ད་གང་བྱུང་མང་བྱུང་ཤེས་ཡ་དང་ཅིག ག་ལབ་དགོས་རེད་ད།  ,rogs pa lab ya de brgyud nas kis/_nga tsho gi da gang byung mang byung shes ya dang cig_ga lab dgos red da/__,https://d38pmlk0v88drf.cloudfront.net/wav16k/STT_NS_M0243_0099_659274_to_664189.wav,STT_NS,3,87,4.915,wav16k/STT_NS_M0243_0099_659274_to_664189.wav,རོགས་པ་ལབ་ཡ་དེ་བརྒྱུད་ནས་སྐྱེས་ང་ཚོ་གིས་ད་ད་གང་བྱུང་མང་བྱུང་ཤེས་ཡ་དང་ཅིག་ག་རེ་ལབ་དགོས་རེད་ད།
STT_NS_M0243_0114_737602_to_740401,ང་ཚོ་གིས་ད་དེ་ལབ་ཀི་རཱ། དབྱིན་ཇིའི་ཐོག་ནས་ལབ་ན་ང་རང་ཚོ་གིས་ ,nga tsho gis da de lab ki rA/_dbyin ji'i thog nas lab na nga rang tsho gis _,https://d38pmlk0v88drf.cloudfront.net/wav16k/STT_NS_M0243_0114_737602_to_740401.wav,STT_NS,3,60,2.799,wav16k/STT_NS_M0243_0114_737602_to_740401.wav,ང་ཚོ་གིས་ད་འདི་ལབ་ཀི་རཱ། དབྱིན་ཇིའི་ཐོག་ནས་ལབ་ན་ང་རང་ཚོ་གིས་
STT_CS-X-2010-M-D-B06-6-R-04_0338_2570639_to_2573813,ཨ་ཚ། ཕར་རྒྱུགས་དང་ཝ་ཡེ།  ,a tsha/_phar rgyugs dang wa ye/__,https://d38pmlk0v88drf.cloudfront.net/wav16k/STT_CS-X-2010-M-D-B06-6-R-04_0338_2570639_to_2573813.wav,STT_CS,3,25,3.174,wav16k/STT_CS-X-2010-M-D-B06-6-R-04_0338_2570639_to_2573813.wav,ཨ་ཚ། ཕར་རྒྱུགས་བདེ་གོ་ཡ་།
STT_NS_M0243_0120_766190_to_769006,ང་ལྟ་བསྡད་ཡ་ད་ངོ་ཚ་ལ། ང་གཅིག་པོ་གཅིག ཨེ་འདྲའི་བསམ་བློ་སླེབས་ཀྱི་འདུག་ད།  ,nga lta bsdad ya da ngo tsha la/_nga gcig po gcig_e 'dra'i bsam blo slebs kyi 'dug da/__,https://d38pmlk0v88drf.cloudfront.net/wav16k/STT_NS_M0243_0120_766190_to_769006.wav,STT_NS,3,73,2.816,wav16k/STT_NS_M0243_0120_766190_to_769006.wav,ང་ལྟ་བསྡད་ཡོད་ད་ངོ་ཚ་བ་ལ་ང་གཅིག་པུ་གཅིག་ཨེ་འདྲའི་བསམ་བློ་སླེབས་ཀི་འདུག་ད།
STT_NS_M0243_0121_769347_to_772184,ཨ་ནས་ག་ལེར་ག་ལེར་ཨོ་དེ་བརླག་འགྲོ་ཡི་འདུག བསམ་བློ་དེ་ཡོད་བ། ཨ་ནས་གཉིས་དེ་ནས། ཨ་ནས།  ,a nas ga ler ga ler o de brlag 'gro yi 'dug_bsam blo de yod ba/_a nas gnyis de nas/_a nas/__,https://d38pmlk0v88drf.cloudfront.net/wav16k/STT_NS_M0243_0121_769347_to_772184.wav,STT_NS,3,83,2.837,wav16k/STT_NS_M0243_0121_769347_to_772184.wav,ཨནས་ག་ལེར་ག་ལེར་ཨོ་དེ་བརླག་འགྲོ་ཡི་འདུག་བསམ་བློ་དེ་ཡོད་བ། ཨེ་ནས་གཉིས་ྡད་ཨེ་ནས།
STT_NS_M0243_0125_785902_to_788696,མ་དགའ་ནས་མ་འགྲོ་བ་ཡོང་སྲིད་ཀྱི་རེད། ཨེ་འདྲའི་བྱས་ནས་ཡང་ཁག་ཁག་ཆགས་ཀྱི་འདུག་བ།  ,ma dga' nas ma 'gro ba yong srid kyi red/_e 'dra'i byas nas yang khag khag chags kyi 'dug ba/__,https://d38pmlk0v88drf.cloudfront.net/wav16k/STT_NS_M0243_0125_785902_to_788696.wav,STT_NS,3,78,2.794,wav16k/STT_NS_M0243_0125_785902_to_788696.wav,མ་དགའ་ནས་མ་འགྲོ་བ་ཡོང་སྲིད་ཀི་རེད། ཨེ་འདྲའི་བྱས་ནས་ཡང་ཁག་ཁག་ཆགས་ཀི་འདུག་བ།
STT_NS_M0243_0127_796813_to_799309,སོ་སོ་ལ་གནོད་པའི་ལས་ཀ་ཅིག་མི་གཅིག་གིས་བྱེད་བཅུག་གི་འདུག་བསམ་ན་ ,so so la gnod pa'i las ka cig mi gcig gis byed bcug gi 'dug bsam na _,https://d38pmlk0v88drf.cloudfront.net/wav16k/STT_NS_M0243_0127_796813_to_799309.wav,STT_NS,3,63,2.496,wav16k/STT_NS_M0243_0127_796813_to_799309.wav,སོ་སོ་ལ་གནོད་པའི་ལས་ཀ་ཅིག་མི་གཅིག་གིས་བྱེད་བཅུག་གི་འདུག་བསམ་ན།
STT_NS_M0243_0135_859468_to_862412,ད་སོ་སོ་གི་ལག་པ་རེད་འདུག་བ། ད་ལྟ་འདྲ་བོ་ཆ་བཞག་བ་འདྲ་ཞིག་ཡིན་ན།  ,da so so gi lag pa red 'dug ba/_da lta 'dra bo cha bzhag ba 'dra zhig yin na/__,https://d38pmlk0v88drf.cloudfront.net/wav16k/STT_NS_M0243_0135_859468_to_862412.wav,STT_NS,3,64,2.944,wav16k/STT_NS_M0243_0135_859468_to_862412.wav,ད་སོ་སོ་གི་ལག་པ་ལ་རེད་འདུག་བ། ད་ད་ལྟ་འདྲ་བོ་ཆ་བཞག་པ་འདྲ་ཞིག་ཡིན་ན།
STT_NS_M0328_0047_278131_to_282005,ཨེ་ནས་ད་ཨོ་འདི་ང་རང་ལམ་སང་བསམ་བློ་འཁོར་སོང་མིན་འདུག་གེ ད་དེ་རིང་གཟའ་པ་སངས་ཡིན་པ་གཞི་ནས་དྲན་སོང་ཡོད་བ།  ,e nas da o 'di nga rang lam sang bsam blo 'khor song min 'dug ge_da de ring gza' pa sangs yin pa gzhi nas dran song yod ba/__,https://d38pmlk0v88drf.cloudfront.net/wav16k/STT_NS_M0328_0047_278131_to_282005.wav,STT_NS,3,103,3.874,wav16k/STT_NS_M0328_0047_278131_to_282005.wav,ཨེ་ནས་ད་ཨོ་འདི་ང་རང་ལམ་སང་བསམ་བློ་འཁོར་སོང་མི་འདུག་བེ། ད་དེ་རིང་གཟའ་པ་སངས་ཡིན་པ་གཞི་ནས་དྲན་སོང་ཡོད་བ།
STT_NS_M0243_0137_865115_to_867846,ནམ་རྒྱུན་དུ་ང་ཅིག་ཟ་སྙིང་འདྲ་བོ་བྲོ་འདྲ་བོ་བྱས་ན།  ,nam rgyun du nga cig za snying 'dra bo bro 'dra bo byas na/__,https://d38pmlk0v88drf.cloudfront.net/wav16k/STT_NS_M0243_0137_865115_to_867846.wav,STT_NS,3,51,2.731,wav16k/STT_NS_M0243_0137_865115_to_867846.wav,ནམ་རྒྱུན་དུ་ང་གཅིག་ཟ་སྙིང་འདྲ་བོ་བྲོ་འདྲ་བོ་བྱས་ན།
STT_NS_M0243_0092_613336_to_619786,ཨ་ནས་དངོས་གནས་ལབ་ཡིན་རཱ་ཡང་། ང་ཚོ་ད་མི་ཆེན་པོ་ཆགས་ཚར་རཱ་ཡང་། བསམ་བློ་བཏང་ན་གཏོང་སྟངས་ཤེས་པ་བྱེད་དགོས་རཱ། བུ་གུ་ཆུང་ཆུང་འདྲ་བོ་བྱེད་ཡ་མེད་རཱ་ཡང་།  ,a nas dngos gnas lab yin rA yang /_nga tsho da mi chen po chags tshar rA yang /_bsam blo btang na gtong stangs shes pa byed dgos rA/_bu gu chung chung 'dra bo byed ya med rA yang /__,https://d38pmlk0v88drf.cloudfront.net/wav16k/STT_NS_M0243_0092_613336_to_619786.wav,STT_NS,3,146,6.45,wav16k/STT_NS_M0243_0092_613336_to_619786.wav,ཨེ་ནས་དངོས་གནས་ལབ་ཡིན་རཱ་ཡང་། ང་ཚོ་ད་མི་ཆེན་པོ་ཆགས་ཚར་རཱ་ཡང་། བསམ་བློ་བཏང་སྟ་བཏང་སྟངས་ཤེས་པ་བྱེད་དགོས་རཱ། བུ་གུ་ཆུང་ཆུང་འདྲ་བོ་བྱེད་ཡ་མེད་རཱ་ཡང་།
STT_NS_M0243_0068_450213_to_455947,གཉིད་ཚར་བའི་གཉིད་ཁུག་ཚར་བའི་གཞུག་ལ་ཨེ་ནས་ཡར་ལངས་སོ་སོ་སོ་སོས་རྒྱུག་ཤད་བྲད། སྐྲ་ཤད་བྲད་བྱེད་ཀི་ཡོད་རེད་ད་རཱ། ཤེལ་སྒོ་གཅིག་ཡོད་ཨོ་དེ་དུས་རཱ།  ,gnyid tshar ba'i gnyid khug tshar ba'i gzhug la e nas yar langs so so so sos rgyug shad brad/_skra shad brad byed ki yod red da rA/_shel sgo gcig yod o de dus rA/__,https://d38pmlk0v88drf.cloudfront.net/wav16k/STT_NS_M0243_0068_450213_to_455947.wav,STT_NS,3,140,5.734,wav16k/STT_NS_M0243_0068_450213_to_455947.wav,གཉིད་ཚར་བའི། གཉིད་ཁུག་ཚར་བའི་གཞུག་ལ་ཨ་ནས་ཡར་ལངས། སོ་སོ་སོ་སོས་རྒྱུག་ཤད་འཕྲད། སྐྲ་ཤད་འཕྲད་བྱེད་ཀི་ཡོད་རེད་ད་རཱ། ཤེལ་སྒོ་གཅིག་ཡོད་རེད། འོ་དེ་དུས་ལ།
STT_NS_M0243_0078_510598_to_514118,ཨེ་འདྲའི་ཚང་མ་ཨེ་ནས་དཔལ་འཛོམས་ཡོད་བ་མགོ་ལ་ཡ་ཡུད་ཤིག་རྒྱག་གི་རེད་ཡོད་བ་ཇཱོཀ་ཚ་བོ་ཡོད་རེད།  ,e 'dra'i tshang ma e nas dpal 'dzoms yod ba mgo la ya yud shig rgyag gi red yod ba jA+oka tsha bo yod red/__,https://d38pmlk0v88drf.cloudfront.net/wav16k/STT_NS_M0243_0078_510598_to_514118.wav,STT_NS,3,90,3.52,wav16k/STT_NS_M0243_0078_510598_to_514118.wav,ཨེ་འདྲའི་ཚང་མ། ཨེ་ནས་དཔལ་འཛོམས་ཡོད་བ་མགོ་ལ་ཡ་ཡུད་ཤི་རྒྱག་གི་རེད་ཡོད་བ། ཡ་ཡུད་ཇོཀཱ་ཚ་བོ་ཡོད་རེད།
STT_NS_M0243_0102_682755_to_686544,ཡོང་བ་ནང་བཞིན། ད་མི་ཚེ་གང་ཚང་རོགས་པ་ལབ་ཡ་དེ་ཁྱོད་མཉམ་དུ་བསྡད་བསྡད་ཀི་མ་རཱ།  ,yong ba nang bzhin/_da mi tshe gang tshang rogs pa lab ya de khyod mnyam du bsdad bsdad ki ma rA/__,https://d38pmlk0v88drf.cloudfront.net/wav16k/STT_NS_M0243_0102_682755_to_686544.wav,STT_NS,3,76,3.789,wav16k/STT_NS_M0243_0102_682755_to_686544.wav,ཡོང་བ་ནང་བཞིན་ ད་མི་ཚེ་གང་ཚང་རོགས་པ་ལབ་ཡ་དེ་ཁྱོད་མཉམ་དུ་བསྡད་བསྡད་ཀི་མ་རཱ།
STT_NS_M0243_0140_878473_to_884382,སྡུག་ག་གང་བྱུང་མ་བྱུང་ཧ་གོ་ཡི་མི་འདུག་བ། དེའི་སྒང་ལ་སྤྱིར་བཏང་ནས་ང་ཚོ་བུ་མོ་གཅིག་རེད། བུད་མེད་ལབ་ཡ་དེ་གཟབ་གཟབ་བྱེད་དགོས་ཡ་དཔེ་སྐད་ཆེན་པོ་རེད།  ,sdug ga gang byung ma byung ha go yi mi 'dug ba/_de'i sgang la spyir btang nas nga tsho bu mo gcig red/_bud med lab ya de gzab gzab byed dgos ya dpe skad chen po red/__,https://d38pmlk0v88drf.cloudfront.net/wav16k/STT_NS_M0243_0140_878473_to_884382.wav,STT_NS,3,143,5.909,wav16k/STT_NS_M0243_0140_878473_to_884382.wav,སྡུག་ག་གང་བྱུང་མ་བྱུང་ཧ་གོ་ཡི་མི་འདུག་བ། དེའི་སྒང་ལ་སྤྱིར་བཏང་ནས་ང་ཚོ་བུ་མོ་གཅིག་རེད། བུད་མེད་ལབ་ཡ་དེ་གཟབ་གཟབ་བྱེད་དགོས་ཡ་དཔེ་གལ་ཆེན་པོ་རེད།
STT_NS_M0243_0166_1001150_to_1003860,ལས་ཀ་ག་འདྲའི་འདྲ་བོ་ཅིག་རག་གི་ཡོད་ན། ཨེ་འདྲ་བྱས་ནས་ང་དཔེ་སེམས་པ་ནང་ལ།  ,las ka ga 'dra'i 'dra bo cig rag gi yod na/_e 'dra byas nas nga dpe sems pa nang la/__,https://d38pmlk0v88drf.cloudfront.net/wav16k/STT_NS_M0243_0166_1001150_to_1003860.wav,STT_NS,3,71,2.71,wav16k/STT_NS_M0243_0166_1001150_to_1003860.wav,ལས་ཀ་ག་འདྲའི་འདྲ་བོ་ཅིག་རག་གི་ཡོད་ན། ཨེ་འདྲའི་བྱས་ནས་ང་དཔེ་སེམས་པ་ནང་།
