file_name,uni,wylie,url,dept,grade,char_len,audio_len,path,inf
STT_TT00662_0555_5066595_to_5074343,འཇིག་རྟེན་ཕལ་པ་རྣམས་ལྟ་ཅི་སྨོས། ཆོས་སྒོར་ཞུགས་པ་ཕལ་ཆེར་ཡང་། ཚེ་འདིའི་སྣང་ཤས་ཀྱི་གདོན་དྲག་པོས་ཡིད་བསྐྱོད་དེ།  ,'jig rten phal pa rnams lta ci smos/_chos sgor zhugs pa phal cher yang /_tshe 'di'i snang shas kyi gdon drag pos yid bskyod de/__,https://d38pmlk0v88drf.cloudfront.net/wav16k/STT_TT00662_0555_5066595_to_5074343.wav,STT_TT,3,109,7.748,wav16k/STT_TT00662_0555_5066595_to_5074343.wav,འཇིག་རྟེན་ཕལ་པ་རྣམས་ལྟ་ཅི་སྨོས། ཆོས་སྒོར་ཞུགས་པ་ཕལ་ཆེར་ཡང་། ཚེ་འདི་འི་སྣང་ཤེས་ཀྱི། གདོན་དྲག་པོས་ཡིད་བསྐྱོད་དེ།
STT_NS_M0285_0154_857002_to_862656,ཨ་ནས་ཁ་ལག་འདྲ་བོ་ཟ་བྱས་ནས་ཡོད་བ། ཨ་ནས་སྟོང་ཕྲག་སུམ་ཅུ་པུ་ར། ཆ་ཚང་གཅིག་ཨ་ནས་ངས་དེ་དུས་ཉི་མ་དེ་ག་རང་ལ་ད་གཏོར་མེད་རཱ།  ,a nas kha lag 'dra bo za byas nas yod ba/_a nas stong phrag sum cu pu ra/_cha tshang gcig a nas ngas de dus nyi ma de ga rang la da gtor med rA/__,https://d38pmlk0v88drf.cloudfront.net/wav16k/STT_NS_M0285_0154_857002_to_862656.wav,STT_NS,3,116,5.654,wav16k/STT_NS_M0285_0154_857002_to_862656.wav,ཨེ་ནས་ཁ་ལག་འདྲ་བོ་ཟ་བྱས་ནས་ཡོད་བ། ཨེ་ནས་སྟོང་ཕྲག་སུམ་ཅུ་པུ་ར་ཆ་ཚང་ཅིག་ཨེ་ནས་ངས་དེ་དུས་ཉི་མ་དེ་ག་རང་ལ་ད་གཏོར་མེད་རཱ།
STT_NS_M0285_0155_863120_to_866197,ཨ་ནས་ད་ག་རེ་རེད། སོ་སོར་དགོས་དགོས་ཡ་དུག་སློག་ག ,a nas da ga re red/_so sor dgos dgos ya dug slog ga_,https://d38pmlk0v88drf.cloudfront.net/wav16k/STT_NS_M0285_0155_863120_to_866197.wav,STT_NS,3,47,3.077,wav16k/STT_NS_M0285_0155_863120_to_866197.wav,ཨེ་ནས་དག་རེ།་སོ་སོ་དགོས་དགོས་ཡ་དུག་སློག་ག
STT_NS_M0320_0485_3266117_to_3272124,ད་དེའི་དུས་ཚོད་དེའི་སྐབས་སུ་ད་ཁོ་ད་མི་རིགས་ནག་པོ་གཅིག་རེད། ཡིན་ན་ཡང་ད་དེའི་ཕྱི་ལོགས་ལ་སྤྱི་ཚོགས་ད་དེ་ལས་ཆེ་བ་དང་།  ,da de'i dus tshod de'i skabs su da kho da mi rigs nag po gcig red/_yin na yang da de'i phyi logs la spyi tshogs da de las che ba dang /__,https://d38pmlk0v88drf.cloudfront.net/wav16k/STT_NS_M0320_0485_3266117_to_3272124.wav,STT_NS,3,115,6.007,wav16k/STT_NS_M0320_0485_3266117_to_3272124.wav,ད་འདིའི་དུས་ཚོད་དེའི་སྐབས་སུ་ད་ཁོ་ད་མི་རིགས་ནག་པོ་གཅིག་རེད། ཡིན་ན་ཡང་ད་འདིའི་ཕྱི་ལོགས་ལ་སྤྱི་ཚོགས་ད་འདི་ལས་ཆེ་བ་དང་།
STT_TT00662_0559_5106936_to_5112482,མཐུན་འབྲེལ་རྡོག་རྩ། དཔེར་ན། སྐྱབས་མགོན་རིན་པོ་ཆེ་འདྲ་བོ་ཡིན་ན། ཆོས་ལུགས་མཐུན་འབྲེལ་དེ་ཞེ་བོ་གནང་གི་འདུག་བ། མང་པོ་ཅིག་དེ་ཁྱོན་ནས་མི་འདུག་བ།  ,mthun 'brel rdog rtsa/_dper na/_skyabs mgon rin po che 'dra bo yin na/_chos lugs mthun 'brel de zhe bo gnang gi 'dug ba/_mang po cig de khyon nas mi 'dug ba/__,https://d38pmlk0v88drf.cloudfront.net/wav16k/STT_TT00662_0559_5106936_to_5112482.wav,STT_TT,3,140,5.546,wav16k/STT_TT00662_0559_5106936_to_5112482.wav,མཐུན་འབྲེལ་རྡོ་ྩ། དཔེར་ན།་སྐྱབས་མགོན་རིན་པོ་ཆེ་འདྲ་བོ་ཡིན་ན། ཆོས་ལུགས་མཐུན་འབྲེལགི་དེ་ཞེ་བོ་གནང་གི་འདུག་ག། མང་པོ་ཅིག་དེ་ཁྱོན་ནས་མི་འདུག་ག།
STT_NS_M0320_0490_3308455_to_3314035,ཨེ་ནས་ད་ད་ཨོ་འདིའི་དུས་ཚོད་སྐབས་སུ་ཨེ་ནས་མི་དེ་ཚོ་ཁོ་རང་ཚོ་འགྲོ་བ་མི་ཀ་ཅི་རང་གཤིས་ཅིག་ཡོད་རཱ།  ,e nas da da o 'di'i dus tshod skabs su e nas mi de tsho kho rang tsho 'gro ba mi ka ci rang gshis cig yod rA/__,https://d38pmlk0v88drf.cloudfront.net/wav16k/STT_NS_M0320_0490_3308455_to_3314035.wav,STT_NS,3,95,5.58,wav16k/STT_NS_M0320_0490_3308455_to_3314035.wav,ཨེ་ནས་ད་ད་ཨོ་དེའི་དུས་ཚོད་སྐབས་སུ་ཨེ་ནས་མི་དེ་ཚོ་ཁོ་རང་ཚོ་འགྲོ་བ་མི་ཀ་ཅི་རང་གཤིས་གཅིག་ཡོད་རཱ།
STT_TT00662_0560_5118251_to_5120491,བརྙེན་བཀུར་གི་ཆེད་དུ་ཕན་ཚུན་འཐབ་ཅིང་རྩོད་པ་དང་།  ,brnyen bkur gi ched du phan tshun 'thab cing rtsod pa dang /__,https://d38pmlk0v88drf.cloudfront.net/wav16k/STT_TT00662_0560_5118251_to_5120491.wav,STT_TT,3,49,2.24,wav16k/STT_TT00662_0560_5118251_to_5120491.wav,བསྙེན་བཀུར་གི་ཆེད་དུ་ཕན་ཚུན་འཐབ་ཅིང་རྩོད་པ་དང་།
STT_TT00662_0566_5160710_to_5162726,ཡོངས་སུ་རྫོགས་པ་གིས་ཆོས་དེ་གས་དེ་ལ།  ,yongs su rdzogs pa gis chos de gas de la/__,https://d38pmlk0v88drf.cloudfront.net/wav16k/STT_TT00662_0566_5160710_to_5162726.wav,STT_TT,3,37,2.016,wav16k/STT_TT00662_0566_5160710_to_5162726.wav,ཡོངས་སུ་རྫོགས་པ་གི་ཆོས་དེ་གས་དེ་ལ།
STT_NS_M0320_0491_3317517_to_3322687,གནག་པོ་འདྲ་བོ་ཡང་མེད་ན་ད་ཚོར་བ་མེད་རྒྱོ་འདྲ་བོ་ཅིག ག་བྱས་ནས་ལབ་ན་ཁོ་ཚོ་ཀ་ཅི་དུས་ཚོད་ལ་མི་ལ་ཡང་ད།  ,gnag po 'dra bo yang med na da tshor ba med rgyo 'dra bo cig_ga byas nas lab na kho tsho ka ci dus tshod la mi la yang da/__,https://d38pmlk0v88drf.cloudfront.net/wav16k/STT_NS_M0320_0491_3317517_to_3322687.wav,STT_NS,3,98,5.17,wav16k/STT_NS_M0320_0491_3317517_to_3322687.wav,གནག་པོ་འདྲ་བོ་ཡང་མིན་ན་ད་ཚོར་བ་མེད་རྒྱོ་འདྲ་བོ་ཅིག ག་བྱས་ནས་ལབ་ན་ཁོ་ཚོ་ཀ་ཅི་དུས་ཚོད་ལ་མི་ལ་ཡང་ད།
STT_TT00662_0563_5140555_to_5143435,ལུང་པ་གཅིག་པ་ཡིན་ན་ཡང་། རྙིང་མ་བཀའ་བརྒྱུད་ས་སྐྱ་གིས་ཁ་བཏང་ཡ།  ,lung pa gcig pa yin na yang /_rnying ma bka' brgyud sa skya gis kha btang ya/__,https://d38pmlk0v88drf.cloudfront.net/wav16k/STT_TT00662_0563_5140555_to_5143435.wav,STT_TT,3,62,2.88,wav16k/STT_TT00662_0563_5140555_to_5143435.wav,ལུང་པ་གཅིག་པ་ཡིན་ན་ཡང་། རྙིང་མ་བཀའ་བརྒྱུད་ས་སྐྱ་གིས་ཁ་གཏང་ཡ།
STT_NS_M0320_0497_3345042_to_3350947,ལས་ཀ་བྱེད་མྱི་ཚང་མ་ཀ་ཅི་ད་ཉལ་ས་དང་ཚང་མ་མཉམ་དུ་ཡིན་དུས་ཙམ་པ་ལ་ཏོག་ཙི་ཁྱིམ་ཚང་ང་ཚོ་ཁྱིམ་ཚང་འདྲ་བོ་ཡིན་པ་ཡིན་ན།  ,las ka byed myi tshang ma ka ci da nyal sa dang tshang ma mnyam du yin dus tsam pa la tog tsi khyim tshang nga tsho khyim tshang 'dra bo yin pa yin na/__,https://d38pmlk0v88drf.cloudfront.net/wav16k/STT_NS_M0320_0497_3345042_to_3350947.wav,STT_NS,3,110,5.905,wav16k/STT_NS_M0320_0497_3345042_to_3350947.wav,ལས་ཀ་བྱེད་མྱི་ཚང་མ་ཀ་ཅི་ད་ཉལ་ས་དང་ཚང་མ་མཉམ་དུ་ཡིན་དུས་ཙམ་པ་ལ་ཏོག་ཙི་ཁྱིམ་ཚང་ང་ཚོ་ཁྱིམ་ཚང་འདྲ་བོ་ཡིན་པ་ཡིན་ན།
STT_NS_M0201_0083_533962_to_536517,དཔེར་ན་ཆ་བཞག་བ་ཡིན་ན་ང་ཚོ་གཞོན་སྐྱེ་དེ་ཚོ་ཡོད་བ།  ,dper na cha bzhag ba yin na nga tsho gzhon skye de tsho yod ba/__,https://d38pmlk0v88drf.cloudfront.net/wav16k/STT_NS_M0201_0083_533962_to_536517.wav,STT_NS,3,50,2.555,wav16k/STT_NS_M0201_0083_533962_to_536517.wav,དཔེར་ན་ཆ་བཞག་པ་ཡིན་ན་ང་ཚོ་གཞོན་སྐྱེས་དེ་ཚོ་ཡི་ཡོད་བ།
STT_TT00662_0577_5277124_to_5284991,ཁོ་རང་ལ་ཡིན་ན་ཡང་། ལྟ་སྒོམ་སྤྱོད་གསུམ་དེ་བསྒོམས་ནས། གདེང་ཚོད་རྣམ་པར་དག་པ། འདི་དང་འདི་ཞེས་བྱ་བ། ཐོབ་སོང་ཟེ་བྱས་ནས། གསལ་པོ་གསུངས་འདུག་བ།  ,kho rang la yin na yang /_lta sgom spyod gsum de bsgoms nas/_gdeng tshod rnam par dag pa/_'di dang 'di zhes bya ba/_thob song ze byas nas/_gsal po gsungs 'dug ba/__,https://d38pmlk0v88drf.cloudfront.net/wav16k/STT_TT00662_0577_5277124_to_5284991.wav,STT_TT,3,136,7.867,wav16k/STT_TT00662_0577_5277124_to_5284991.wav,ཁོ་རང་ལ་ཡིན་ན་ཡང་། ལྟ་སྒོམ་སྤྱོད་གསུམ་དེ་བསྒོམས་ནས། གདེང་ཚོད་རྣམ་པར་དག་པ་འདི་དང་འདི་ཞེས་བྱ་བ་ཐོབ་སོང་ཟེ་བྱས་ནས། གསལ་པོ་གསུངས་འདུག་ག།
STT_NS_M0320_0499_3362677_to_3368830,ད་ཆེན་པོ་གཅིག་ནང་ལོགས་ལ་ཚང་མ་མཉམ་དུ་བསྡད་ཀི་ཡོད་རཱ། ཁྱིམ་ཚང་འདྲ་བོ་ཆ་བཞག་པ་ཡིན་ན་ཨེ་འདྲའི་འདྲ་བོ་ཅིག་ཡོད་རེད་ཡོད་བ། ཁོ་ཚོ་ད་ལས་ཀ་བྱེད་ས་དེ་ལ་ཉལ་ས།  ,da chen po gcig nang logs la tshang ma mnyam du bsdad ki yod rA/_khyim tshang 'dra bo cha bzhag pa yin na e 'dra'i 'dra bo cig yod red yod ba/_kho tsho da las ka byed sa de la nyal sa/__,https://d38pmlk0v88drf.cloudfront.net/wav16k/STT_NS_M0320_0499_3362677_to_3368830.wav,STT_NS,3,148,6.153,wav16k/STT_NS_M0320_0499_3362677_to_3368830.wav,ད་ཆེན་པོ་གཅིག་ནང་ལོགས་ལ་ཚང་མ་མཉམ་དུ་བསྡད་ཀི་ཡོད་རཱ། ཁྱིམ་ཚང་འདྲ་བོ་ཆ་བཞག་པ་ཡིན་ན་ཨེ་འདྲའི་འདྲ་བོ་ཅིག་ཡོད་རེད་ཡོད་བ། ཁོ་ཚོ་ད་ལས་ཀ་བྱེད་ས་དེ་ལ་ཉལ་ས།
STT_NS_M0285_0164_907633_to_912300,ཨེ་ནས་ངས་ཨེ་ནས་ཏག་ཏག་རེད་ལབ་ཀི་རཱ་འགྲོ་ན། ང་རང་ང་རང་འདིར་གཟུགས་པོ་བདེ་བོ་མེད་ཨེ་ནས་མོ་མོ་རང་ལ་ད།  ,e nas ngas e nas tag tag red lab ki rA 'gro na/_nga rang nga rang 'dir gzugs po bde bo med e nas mo mo rang la da/__,https://d38pmlk0v88drf.cloudfront.net/wav16k/STT_NS_M0285_0164_907633_to_912300.wav,STT_NS,3,98,4.667,wav16k/STT_NS_M0285_0164_907633_to_912300.wav,ཨེ་ནས་ངས་ཨེ་ནས་ཏག་ཏག་རེད་ལབ་ཀིན་རཱ། འགྲོ་ན། ང་ང་རང་དེ་གཟུགས་པོ་བདེ་བོ་མེད། ཨེ་ནས་མོ་མོ་རང་ལ་ཡིན་ད།
STT_TT00662_0580_5308609_to_5316134,དེ་ནང་བཞིན་གི་ཨ་ཅིག་གི་དཔལ་ས་སྐྱའི་ནང་ལ་ཡ་ལ་ས་སྐྱ་གོང་མ་རྣམ་ལྔ་ལ་སོགས་པ་བསམ་གྱིས་མི་ཁྱབ་པ་ག་ཚོད་འདུག འཇམ་དཔལ་དབྱངས་ཀི་སྤྲུལ་པ་ཡང་ག་ཚོད་འདུག ,de nang bzhin gi a cig gi dpal sa skya'i nang la ya la sa skya gong ma rnam lnga la sogs pa bsam gyis mi khyab pa ga tshod 'dug_'jam dpal dbyangs ki sprul pa yang ga tshod 'dug_,https://d38pmlk0v88drf.cloudfront.net/wav16k/STT_TT00662_0580_5308609_to_5316134.wav,STT_TT,3,140,7.525,wav16k/STT_TT00662_0580_5308609_to_5316134.wav,དེ་ནང་བཞིན་གི ཨ་ཅིག་གི དཔལ་ས་སྐྱའི་ནང་ལ་ཡ། ས་སྐྱ་གོང་མ་རྣམ་ལྔ་ལ་སོགས་པ་བསམ་གྱིས་མི་ཁྱབ་པ་ག་ཚོད་འདུག འཇམ་དཔལ་དབྱངས་ཀི་སྤྲུལ་པ་ཡང་ག་ཚོད་འདུག
STT_TT00662_0588_5371203_to_5374445,མི་གཞན་དག་ལ་ཁ་གཏང་། མི་གཞན་དག་གི་སེམས་དཀྲུག གཞན་དག་ཡང་དེ་མེད།  ,mi gzhan dag la kha gtang /_mi gzhan dag gi sems dkrug_gzhan dag yang de med/__,https://d38pmlk0v88drf.cloudfront.net/wav16k/STT_TT00662_0588_5371203_to_5374445.wav,STT_TT,3,63,3.242,wav16k/STT_TT00662_0588_5371203_to_5374445.wav,མི་གཞན་དག་ལ་ཁ་བཏང་། མི་གཞན་དག་གིས་སེམས་དཀྲུགས། གཞན་དག་ཡང་དེ་མེད།
STT_NS_M0285_0166_925524_to_928543,མོ་འདྲ་བོ་ཨ་ནས་དེ་ཨ་ནས་མོ་མོ་རང་ཡིན་ན་ད་ཨེ་འདྲའི།  ,mo 'dra bo a nas de a nas mo mo rang yin na da e 'dra'i/__,https://d38pmlk0v88drf.cloudfront.net/wav16k/STT_NS_M0285_0166_925524_to_928543.wav,STT_NS,3,51,3.019,wav16k/STT_NS_M0285_0166_925524_to_928543.wav,ད་མོ་འདྲ་བོ་ཨེ་ནས་དེ་ཨེ་ནས་མོ་རང་ཡིན་ན་ད་ཨེ་འདྲའི།
STT_NS_M0285_0170_938025_to_940300,ཨ་ནས་ཁོ་གཉིས། ཁོ་བདམས་རེད་ཡོད་བ། ཨ་ནས།  ,a nas kho gnyis/_kho bdams red yod ba/_a nas/__,https://d38pmlk0v88drf.cloudfront.net/wav16k/STT_NS_M0285_0170_938025_to_940300.wav,STT_NS,3,40,2.275,wav16k/STT_NS_M0285_0170_938025_to_940300.wav,ཨེ་ནས་ཁོ་གཡིས་ཁོ་གདམས་རེད་ཡོད་བ། ཨེ་ནས།
STT_NS_M0285_0158_870783_to_875357,ཁ་ཤས་ཤིག་རག་མ་སོང་རཱ། ཨ་ནས་འོ་དེའི་རྗེས་ལ་ག་ལེར་ག་ལེར་བྱས་ནས། ཨ་ནས་ལྷག་མ་དེ་ག་ལེར་ག་ལེར་བྱས་ནས་གཏོར་ཡོད་རཱ།  ,kha shas shig rag ma song rA/_a nas 'o de'i rjes la ga ler ga ler byas nas/_a nas lhag ma de ga ler ga ler byas nas gtor yod rA/__,https://d38pmlk0v88drf.cloudfront.net/wav16k/STT_NS_M0285_0158_870783_to_875357.wav,STT_NS,3,109,4.574,wav16k/STT_NS_M0285_0158_870783_to_875357.wav,ཁ་ཤས་ཤིག་རག་མ་སོང་རཱ། ཨེ་ནས་ཨོ་དེའི་རྗེས་ལ་ག་ལེ་ག་ལེར་བྱས་ནས། ཨེ་ནས་ལྷག་མ་དེ་ག་ལེར་ག་ལེར་བྱས་ནས་གཏོར་ཡིན་རཱ།
STT_NS_M0285_0159_882033_to_884843,ད་ང་རང་ང་དང་དགའ་བོ་དང་པོ་དེ་འཁྲུག་ཡ་གི་ད།  ,da nga rang nga dang dga' bo dang po de 'khrug ya gi da/__,https://d38pmlk0v88drf.cloudfront.net/wav16k/STT_NS_M0285_0159_882033_to_884843.wav,STT_NS,3,43,2.81,wav16k/STT_NS_M0285_0159_882033_to_884843.wav,ད་ང་རང་ང་དང་དགའ་བོ་དང་པོ་དེ་འཁྲུ་ཡ་གི་ད།
STT_TT00674_0431_4264345_to_4266585,ཕན་ཡོན་ཤིན་ཏུ་ཆེ་བར་གསུངས་པ་ལྟར་ཡིན།  ,phan yon shin tu che bar gsungs pa ltar yin/__,https://d38pmlk0v88drf.cloudfront.net/wav16k/STT_TT00674_0431_4264345_to_4266585.wav,STT_TT,3,38,2.24,wav16k/STT_TT00674_0431_4264345_to_4266585.wav,ཕན་ཡོན་ཤིན་ཏུ་ཆེ་བར་གསུངས་པ་ལྟར་ཡིན།
STT_NS_M0285_0162_896383_to_898508,ང་ཚོ་སློབ་གྲྭ་གཅིག་པ་རེད། ང་ཚོ་ཚང་མ་འཛིན་གྲོགས་གཅིག་པ་རེད།  ,nga tsho slob grwa gcig pa red/_nga tsho tshang ma 'dzin grogs gcig pa red/__,https://d38pmlk0v88drf.cloudfront.net/wav16k/STT_NS_M0285_0162_896383_to_898508.wav,STT_NS,3,60,2.125,wav16k/STT_NS_M0285_0162_896383_to_898508.wav,ང་ཚོ་སློབ་གྲྭ་གཅིག་པ་རེད། ང་ཚོ་ཚང་མ་འཛིང་གྲོགས་གཅིག་པ་རེད།
STT_NS_M0285_0163_902652_to_907238,ཁོ་གིས་མོ་ལ་འབྲེལ་བ་འདྲ་བོ་བཞག་བྱེད་དུས་ཨེ་ནས་རང་འཇགས་འགྲོ་ཡི་ཡིན་མདོག་མདོག་འདྲ་བོ་སྐད་ཆ་འདྲ་བོ་ལབ་སོང་ཡོད་བ། ཨེ་ནས།  ,kho gis mo la 'brel ba 'dra bo bzhag byed dus e nas rang 'jags 'gro yi yin mdog mdog 'dra bo skad cha 'dra bo lab song yod ba/_e nas/__,https://d38pmlk0v88drf.cloudfront.net/wav16k/STT_NS_M0285_0163_902652_to_907238.wav,STT_NS,3,118,4.586,wav16k/STT_NS_M0285_0163_902652_to_907238.wav,ཁོ་གིས་མོ་ལ་འབྲེལ་བ་འདྲ་བོ་བཞག་བྱེད་དུས་ཨེ་རང་འཇགས་འགྲོ་གི་ཡིན་མདོག་མདོག་འདྲ་བོ་སྐད་ཆ་འདྲ་བོ་ལབ་སོང་ཡོད་བ། ཨེ་ནས།
STT_NS_M0285_0174_951925_to_955815,ཨ་ནས་དེ་འདྲའི་ཨ་ནས་ངས་ཡ་ཡ་དཀའ་ངལ་འདྲ་བོ་ད་ཨེ་འདྲའི།  ,a nas de 'dra'i a nas ngas ya ya dka' ngal 'dra bo da e 'dra'i/__,https://d38pmlk0v88drf.cloudfront.net/wav16k/STT_NS_M0285_0174_951925_to_955815.wav,STT_NS,3,53,3.89,wav16k/STT_NS_M0285_0174_951925_to_955815.wav,ཨེ་ནས་དེ་འདྲའི་ཨེ་ནས་ཡ་ཡ་ད་དཀའ་ངལ་འདྲ་བོ་ད་ཨེ་འདྲའི།
STT_NS_M0285_0175_958125_to_963431,ཨ་ནས་རྗེས་ལ་ཨ་ནས་རྗེས་ལ་ང་ད་ད་བླ་མ་མཐོ་སློབ་ཕོ་མོ་མཉམ་དགའ་བོ་ཆགས་ཨེ་འདྲའི་བྱེད་དུས།  ,a nas rjes la a nas rjes la nga da da bla ma mtho slob pho mo mnyam dga' bo chags e 'dra'i byed dus/__,https://d38pmlk0v88drf.cloudfront.net/wav16k/STT_NS_M0285_0175_958125_to_963431.wav,STT_NS,3,85,5.306,wav16k/STT_NS_M0285_0175_958125_to_963431.wav,ཨེ་ནས་རྗེས་ལ་ཨེ་ནསརྗེས་ལ་ང་ད་དེ་ཏཱ་ལའི་བླ་མ་མཐོ་སློབ་བུ་མོ་མཉམ་ད་དགའ་བོ་ཆགས་ཨེ་འདྲའི་བྱེད་དུས།
STT_NS_M0320_0533_3608013_to_3610927,ཡི་གེ་སྦྱངས་ཡིན་བསམ་བསམ་འདྲ་བོ་གཅིག་འདུག་བ། ཡི་གེ་ག་རེ་སྦྱང་བ་ཡིན་ན་ཡང་།  ,yi ge sbyangs yin bsam bsam 'dra bo gcig 'dug ba/_yi ge ga re sbyang ba yin na yang /__,https://d38pmlk0v88drf.cloudfront.net/wav16k/STT_NS_M0320_0533_3608013_to_3610927.wav,STT_NS,3,74,2.914,wav16k/STT_NS_M0320_0533_3608013_to_3610927.wav,ཡི་གེ་སྦྱངས་ཡིན་བསམ་བསམ་འདྲ་བོ་ཅིག་འདུག་བ། ཡི་གེ་ག་རེ་སྦྱང་བ་ཡིན་ན་ཡང་།
STT_NS_M0320_0503_3384295_to_3391203,དུས་ཚོད་ཡོད་མ་རེད་ཡོད་བ། ཨེ་ནས་ད་རྗེས་ད་ཁོ་རང་ཁྱི་དེ་ལ་ད་གཟུགས་པོ་འདྲ་བོ་བཀྲུས་ཨེ་འདྲའི་འདྲ་བོ་ག་ཀུ་ཅི་བྱེད་ཡོད་མ་རེད་ཡོད་བ། ཨེ་ནས་ཨོ་ཙང་ད་ཁྱི་དེ་དཔེ་དྲི་མ་ཛོར་བོ་ཁ་གི་ཡོད་རེད།  ,dus tshod yod ma red yod ba/_e nas da rjes da kho rang khyi de la da gzugs po 'dra bo bkrus e 'dra'i 'dra bo ga ku ci byed yod ma red yod ba/_e nas o tsang da khyi de dpe dri ma dzor bo kha gi yod red/__,https://d38pmlk0v88drf.cloudfront.net/wav16k/STT_NS_M0320_0503_3384295_to_3391203.wav,STT_NS,3,178,6.908,wav16k/STT_NS_M0320_0503_3384295_to_3391203.wav,དུས་ཚོད་ཡོད་མ་རེད་ཡོད་བ། ཨེ་ནས་ད་རྗེས་ད་ཁོ་རང་ཁྱི་དེ་ལ་ད་གཟུགས་པོ་འདྲ་བོ་བཀྲུས་ཨེ་འདྲའི་འདྲ་བོ་གེ་ཀུ་ཅི་བྱས་ཡོད་མ་རེད་ཡོད་བ། ཨེ་ནས་ཨོ་ཙང་ད་ཁྱི་དེ་དཔེ་དྲི་མ་ཛོར་པོ་ཁག་གི་ཡོད་རེད།
STT_NS_M0285_0165_915017_to_917351,སྤྲད་ཐུབ་ཡོད་མེད་ང་རང་ཡེ་ཧ་གོ་མ་སོང་རཱ། ཨ་ནས་ཨོ་འདིས།  ,sprad thub yod med nga rang ye ha go ma song rA/_a nas o 'dis/__,https://d38pmlk0v88drf.cloudfront.net/wav16k/STT_NS_M0285_0165_915017_to_917351.wav,STT_NS,3,55,2.334,wav16k/STT_NS_M0285_0165_915017_to_917351.wav,སྤྲད་ཐུབ་ཀི་ཡོད་མེད་ང་རང་ཡིས་ཧ་གོ་མ་སོང་རཱ། ཨེ་ནས་ཨོ་དེ།
STT_NS_M0285_0167_928577_to_932176,ཐེ་ཚོམ་འདྲ་བོ་རེད་ཤག སུས་གདམ་གྱི་ཡོད་རེད་མགོ་འཚོས་ཀི་མི་འདུག་འདྲ་བོ་ལབ། ཨེ་ནས་ག་སུ་གདམ་དགོས་ ,the tshom 'dra bo red shag_sus gdam gyi yod red mgo 'tshos ki mi 'dug 'dra bo lab/_e nas ga su gdam dgos _,https://d38pmlk0v88drf.cloudfront.net/wav16k/STT_NS_M0285_0167_928577_to_932176.wav,STT_NS,3,93,3.599,wav16k/STT_NS_M0285_0167_928577_to_932176.wav,ཐེ་ཚོམ་འདྲ་བོ་རེད་ཤག སུས་གདམ་གོས་རེད། མགོ་ཚོད་ཀི་མི་འདུག་འདྲ་བོ་ལབ། ཨེ་ནས་ག་རེ་སུས་གདམ་དགོས།
STT_NS_M0320_0516_3474445_to_3477585,བཟང་སྤྱོད་ལབ་ཡ་དང་ཨེ་འདྲའི་འདྲ་བོ་ད་གཅིག་མེད་རྒྱོ་འདྲ་བོ་གཅིག་མཐོང་སོང་རཱ།  ,bzang spyod lab ya dang e 'dra'i 'dra bo da gcig med rgyo 'dra bo gcig mthong song rA/__,https://d38pmlk0v88drf.cloudfront.net/wav16k/STT_NS_M0320_0516_3474445_to_3477585.wav,STT_NS,3,76,3.14,wav16k/STT_NS_M0320_0516_3474445_to_3477585.wav,བཟང་སྤྱོད་ལབ་ཡ་དང་ཨེ་འདྲའི་འདྲ་བོ་ད་ཅིག་ཡེ་མེད་རྒྱོ་འདྲ་བོ་ཅིག་མཐོང་སོང་རཱ།
STT_NS_M0320_0514_3461663_to_3469513,སེམས་ཅན་ད་ཕར་བཞག་རཱ། ཁོ་ཚོ་གིས་དང་པོ་མི་ལ་ཁོ་རང་དཔེ་ད་ཨོང་གནག་པོ་འདྲ་བོ་བྱས། ད་ཨེ་འདྲ་འདྲ་བོ་ཅིག་བྱེད་ཀི་འདུག་བ།  ,sems can da phar bzhag rA/_kho tsho gis dang po mi la kho rang dpe da ong gnag po 'dra bo byas/_da e 'dra 'dra bo cig byed ki 'dug ba/__,https://d38pmlk0v88drf.cloudfront.net/wav16k/STT_NS_M0320_0514_3461663_to_3469513.wav,STT_NS,3,114,7.85,wav16k/STT_NS_M0320_0514_3461663_to_3469513.wav,སེམས་ཅན་ད་ཕར་བཞག་རཱ། ཁོ་ཚོ་གིས་དང་པོ་མི་ལ་ཁོ་རང་དཔེ་ད་ཨགནག་པོ་འདྲ་བོ་བྱས། ད་ཨེ་འདྲའི་འདྲ་བོ་ཅིག་བྱེད་ཀི་འདུག་བ།
